Health_System_ID,Health_System_Name,Bed_Size,Staff_Labor_Rate,Agency_Labor_Rate,Agency_Labor_FTE,Estimated_RN_Need,Agency>Staff,State(s),Affiliated_Hospitals
HSI00000809,Palomar Health,411.0,72.20757858585092,114.33252449050167,82.71947115384616,73.52841880341882,True,CA,"Palomar Medical Center Escondido, Palomar Medical Center Poway"
HSI00000298,Parkland Health and Hospital System,790.0,52.36375026748393,116.20728061139853,124.61971153846154,110.77307692307693,True,TX,Dallas Co. Hosp. Dist.
HSI00000811,Parkview Health System,1112.0,144.41669345583955,96.66284390786507,122.3944903846154,108.79510256410258,False,"IN, OH","Chwc-Montpelier, Community Hospital Of Noble Cty  Inc, Community Hospital Of Williams City, Huntington Memorial Hospital, Orthopaedic Hospt.At Parkview, Parkview - Dekalb Health, Parkview Hospital, Parkview Lagrange Hospital, Parkview Wabash Hospital  Inc., Whitley Memorial Hospital"
HSI00001341,Parkview Medical Center,251.0,50.06934084615972,100.45507044226443,110.13827403846153,97.90068803418802,True,CO,Parkview Medical Center
HSI00000812,Parrish Medical Center,208.0,40.94680280824355,68.46743682006607,68.54278846153846,60.92692307692308,True,FL,Parrish Medical Center
HSI00000814,Peacehealth,1222.0,62.3576356661377,106.93378568749743,152.54951923076922,135.59957264957265,True,"AK, OR, WA","Cottage Grove Community Hospital, Ketchikan Medical Center, Peace Harbor Hospital, Peace Island Medical Center, Peacehealth Southwest Medical Center, Shmc-Riverbend, St. John Medical Center, St. Joseph Medical Center, United General Medical Center"
HSI00000819,Penn Highlands Healthcare,661.0,40.93832190065076,98.98006014695507,84.789125,75.36811111111112,True,PA,"Brookville Hospital, Dubois Regional Medical Center, Highlands Hospital, Monongahela Valley Hospital Inc., Penn Highlands Elk, Penn Highlands Huntingdon, Tyrone Hospital"
HSI00000821,Penn State Health Milton S Hershey Medical Center,1205.0,56.437134374602785,95.13721266612022,339.34637019230775,301.641217948718,True,PA,"Hampden Medical Center, Holy Spirit Hospital, Lancaster Medical Center, Milton S. Hershey Medical Center, St. Joseph Medical Center"
HSI00000822,Peterson Health,98.0,51.40867433289605,88.9137126415002,57.46925480769231,51.08378205128206,True,TX,Peterson Regional Medical Center
HSI00000823,Phoebe Putney Health Systems,487.0,47.93587653366066,63.15980694589947,221.9913798076923,197.32567094017094,True,GA,"Dorminy Medical Center, Phoebe Putney Memorial Hospital, Phoebe Sumter Medical Center  Inc, Phoebe Worth Medical Center"
HSI00000826,Piedmont Healthcare,3790.0,50.69832898452527,78.232565244967,1025.0667259615384,911.1704230769232,True,GA,"Piedmont Athens Regional Medical Ce, Piedmont Cartersville Medical Center, Piedmont Columbus Regional Midtown, Piedmont Columbus Regional Northside, Piedmont Eastside Medical Center, Piedmont Fayette Hospital Inc., Piedmont Henry Hospital  Inc., Piedmont Hospital Inc., Piedmont Macon Medical Center, Piedmont Macon North Hospital, Piedmont Mountainside Hospital  Inc., Piedmont Newnan Hospital Inc., Piedmont Newton Hospital, Piedmont Rockdale Hospital, Piedmont Walton Hospital, University Health Services  Inc., University Hospital Mcduffie"
HSI00001423,Pikeville Medical Center,328.0,41.39299021094769,84.83716956689192,68.65625,61.02777777777778,True,KY,Pikeville Medical Center
HSI00000067,Pipeline Health,808.0,51.7708750287412,93.8083688907165,121.47437500000001,107.97722222222222,True,"CA, IL, TX","Coast Plaza Hospital, Community Hospital Of Huntington Par, East Los Angeles Doctors Hospital, Louis A. Weiss Memorial Hospital, Memorial Hospital Of Gardena, West Suburban Hosp Med Ctr, White Rock Medical Center"
HSI00000833,Pomona Valley Hospital Medical Center,427.0,78.61226939223152,86.2950539142196,44.8731875,39.887277777777776,False,CA,Pomona Valley Hospital Med Ctr
HSI00000842,Premier Health,1308.0,48.06091001771382,86.44839016372578,425.79521153846156,378.48463247863253,True,OH,"Atrium Medical Center, Miami Valley Hospital, Upper Valley Medical Center"
HSI00000843,Presbyterian Healthcare Services,1052.0,50.063980718660275,98.17104298053818,149.58346634615384,132.9630811965812,True,NM,"Dr. Dan C. Trigg, Espanola Hospital, Lincoln County Medical Center, Plains Regional Medical Ctr - Clovis, Presbyterian Hospital, Santa Fe Medical Center, Socorro General Hospital"
HSI00000845,Prime Healthcare Services,5645.0,53.22882972952741,82.68679573481297,503.58509615384617,447.6311965811966,True,"AL, CA, FL, GA, IN, KS, MI, MO, NJ, NV, OH, PA, RI, TX","Centinela Hospital Medical Center, Chino Valley Medical Center, Coshocton Regional Medical Center, Dallas Medical Center, Dallas Regional Medical Center, Desert Valley Hospital  Inc., East Liverpool City Hospital, Encino Hospital, Garden City Hospital Osteopathic, Garden Grove Hospital Medical Center, Harlingen Medical Center, Huntington Beach Hospital, Knapp Medical  Center, La Palma Intercommunity Hospital, Lake Huron Medical Center, Landmark Medical Center, Lehigh Regional, Lower Bucks Hospital, Mission Regional Medical Center, Monroe Hospital, Montclair Hospital Medical Center, North Vista Hospital, Pampa Regional Medical Center, Paradise Valley Hospital, Providence Medical Center, Riverview Regional Medical Center, Roxborough Memorial Hospital, Saint John Hospital, San Dimas Community Hospital, Shasta Regional Medical Center, Sherman Oaks Hospital-Hlth, Southern Regional Medical Center, St Francis Medical Center, St Joseph Medical Center, St Marys Medical Center, St Marys Regional Medical Center, St. Clares  Hospital, St. Marys Hospital - Passaic, St. Michaels Medical Center, Suburban Community Hospital, West Anaheim Medical Center"
HSI00001378,Prisma Health,2232.0,56.44516142334367,86.0646877287549,462.3692307692308,410.9948717948718,True,SC,"Ghs Greenville Memorial Hospital, Oconee Memorial Hospital, Ph Baptist Easley Hospital, Ph Baptist Parkridge Hospital, Ph Greer Memorial Hospital, Ph Hillcrest Hospital, Ph Laurens County Hospital, Ph Patewood Hospital, Prisma Health Baptist Hospital, Prisma Health Richland Hospital, Prisma Health Tuomey Hospital"
HSI00000848,ProMedica,1260.0,46.165248301342594,89.04041166553434,57.31875,50.95,True,"MI, OH","Bay Park Community Hospital, Defiance Hospital Inc., Fostoria Community Hospital, Insight Hospital And Medical Center, Lima Memorial Hospital, Memorial Hospital, Monroe Regional Hospital, Promedica Hickman Hospital, The Toledo Hospital"
HSI00000847,Prohealth Care,335.0,49.957067448259416,83.82133776578887,122.86990384615385,109.21769230769232,True,WI,"Oconomowoc Memorial Hospital, Waukesha Memorial Hospital"
HSI00000851,Prospect Medical Holdings,1866.0,64.20859560577331,101.68856854803059,206.3533798076923,183.4252264957265,True,"CA, CT, PA, RI","Crozer Chester Medical Center, Foothill Reg Medical Center, Los Angeles Community Hospital, Manchester Memorial Hospital, Our Lady Of Fatima Hospital, Rockville General Hospital  Inc., Roger Williams Medical Center, So Calif Hospital At Hollywood, Waterbury Hospital"
HSI00000852,Providence,9268.0,72.24538380244618,61.12825970350747,1978.212375,1758.4110000000003,False,"AK, CA, MT, NM, OR, TX, WA","Clark Fork Valley Hospital, Covenant Health Hobbs Hospital, Covenant Hospital Levelland, Covenant Hospital Plainview, Covenant Medical Center, Grace Medical Center, Healdsburg Hospital, Hood River Memorial Hospital, Kadlec Regional Medical Center, Mission Hospital Reg Medical Center, Petaluma Valley Hospital, Prov Regl Med Center Everett, Prov Sacred Heart Medical Center, Prov St Mary Medical Center, Prov. Kodiak Island Medical Center, Providence Alaska Medical Center, Providence Cedars-Sinai Tarzana Medi, Providence Centralia Hospital, Providence Holy Cross Med. Center, Providence Holy Family Hospital, Providence Lttl Co Mary Mc San Pedro, Providence Lttl Co Mary Mc Torrance, Providence Medford Medical Center, Providence Milwaukie Hospital, Providence Mount Carmel Hospital, Providence Newberg Medical Center, Providence Portland Medical Center, Providence Seaside Hospital, Providence Seward Medical & Care Cen, Providence St Johns Health Center, Providence St Joseph Medical Center, Providence St Joseph Medical Ctr, Providence St Josephs Hospital, Providence St. Peter Hospital, Providence St. Vincent Medical Ctr, Providence Valdez Medical Center, Providence Willamette Falls Med Ctr, Queen Of The Valley Medical Center, Redwood Memorial Hospital, Santa Rosa Memorial Hospital, St Jude Medical Center Fullerton, St Patrick Hospital, St. Joseph Hospital - Eureka, St. Joseph Hospital Of Orange, St. Mary Medical Center, Swedish Edmonds, Swedish Issaquah, Swedish Medical Center, Swedish Medical Center Cherry Hill"
HSI00000860,Quorum Health Corporation,1539.0,48.51743105924781,64.04082715627563,204.53580769230769,181.80960683760685,True,"AL, AR, CA, CO, GA, IA, IL, KS, KY, LA, ME, MN, MO, MS, NC, NM, NV, NY, OK, OR, TX, UT, WY","Alta Vista Regional Hospital, Barstow Community Hospital, Bayou Bend Health System, Big Bend Regional Med Ctr, Bothwell Regional Health Center, Carthage Area Hospital, Choctaw Memorial Hospital, Dekalb Regional Medical Center, Evanston Regional, Fairfax Community Hospital, Fannin Regional Hospital, Forrest City Medical Center, Graham Regional Medical Center, Heartland Regional Medical Center, Jennie Stuart Medical Center, Kentucky River Medical Center, Lane Regional Medical Center, Madelia Health, Magnolia Hospital, Mckenzie-Willamette Hospital, Mesa View Regional Hospital, Mimbres Memorial Hospital, Mountain West Medical Center, Nevada Regional Medical Center, Northern Hosp Of Surry Co, Ouachita County Medical Center, Penobscot Valley Hospital, Red Bud Regional Hospital, St. Luke Hospital, The Memorial Hospital, Three Rivers Medical Center, Union County Hospital District, Washington County Hospital"
HSI00000863,RWJBarnabas Health,3876.0,60.86436605002358,97.00095978671388,875.4148461538462,778.1465299145299,True,NJ,"Clara Maass Medical Center, Community Medical Center, Cooperman Barnabas Medical Center, Jersey City Medical Center, Monmouth Medical Center, Monmouth Medical Center Southern Cam, Newark Beth Israel Medical Center, Robert Wood Johnson Hospital @ Hami, Robert Wood Johnson Hospital @ Rahw, Robert Wood Johnson Univ Hosp @ Som, Robert Wood Johnson University Hospi, Trinitas Hospital"
HSI00000867,Redlands Community Hospital,195.0,62.845136002058894,103.65688662533215,34.738461538461536,30.87863247863248,True,CA,Redlands Community Hospital
HSI00000870,Regional One Health,291.0,42.328796944247074,46.82648927769162,234.9971153846154,208.8863247863248,False,TN,Regional One Health
HSI00000871,Regional West Health Services,131.0,46.460748375221165,92.23041246758801,35.97019230769231,31.973504273504275,True,NE,"Regional West Garden County Hospital, Regional West Medical Center"
HSI00000873,Reid Health,207.0,51.77873427519693,75.88243305104045,55.88337980769231,49.674115384615384,True,IN,Reid Hospital & Health Care Services
HSI00000874,Renown Health,641.0,56.35446555025341,88.65150024600501,187.51572115384616,166.68064102564105,True,NV,"Renown Regional Medical Center, Renown South Meadows Med Ctr"
HSI00000879,Richmond University Medical Center,209.0,69.59860714816135,44.4291377256961,55.30432692307692,49.15940170940171,False,NY,Richmond University Medical Center
HSI00000881,Ridgeview Medical Center,157.0,56.81368241477792,91.7512816720613,21.292235576923076,18.926431623931624,True,MN,"Minnesota Valley Health Center  Inc., Ridgeview Medical Center, Sibley Medical Center"
HSI00000882,Riverside Health Care System,319.0,69.55436663016272,127.91836734693878,16.65528846153846,14.804700854700856,True,NY,St. Johns Riverside Hospital
HSI00000883,Riverside Health System,592.0,53.496534216626465,93.96860868188136,54.645192307692305,48.57350427350428,True,VA,"Riverside Doctors Hospital Williamsb, Riverside Regional Medical Center, Riverside Walter Reed, Shore Memorial Hospital"
HSI00001533,Riverside Healthcare,256.0,52.86368675020824,81.82535403514758,42.26682692307692,37.57051282051282,True,IL,Riverside Medical Center
HSI00000887,Riverview Hospital,133.0,48.38250002866461,102.4747105408618,7.862807692307692,6.989162393162393,True,IN,Riverview Hospital
HSI00000889,Rochester Regional Health System,1089.0,43.82951889171312,103.81911654396842,1005.6331730769231,893.8961538461539,True,NY,"Clifton Springs Hospital & Clinic, Newark Wayne Community Hospital, Rochester General Hospital, The Unity Hospital Of Rochester, United Memorial Medical Center, Unity Speciality Hospital"
HSI00000897,Rush System for Health,985.0,56.25808619236085,110.71011464738977,117.58461538461539,104.51965811965813,True,IL,"Copley Memorial Hospital, Oak Park Hospital, Rush University Medical Center"
HSI00000900,Rutland Regional Health Services,134.0,60.4750823985968,79.98781980801772,61.65432692307692,54.80384615384615,True,VT,Rutland Regional Medical Center
HSI00000910,SBH Health System,283.0,74.92979962033444,99.01621974081017,70.7826923076923,62.917948717948725,True,NY,Sbh Health System
HSI00000902,SSM Health,4101.0,61.18339654648535,57.635432011712176,1014.131826923077,901.450512820513,False,"IL, MO, OK, WI","Clay County Hospital, Cordell Memorial Hospital, Edgerton Hospital & Health Services, Madison Medical Center, Monroe Clinic, Okeene Municipal Hospital, Pinckneyville Community Hospital, Prairie Ridge Health  Inc., Purcell Municipal Hospital, Ripon Medical Center, Share Medical Center, Ssm Health Depaul Hospital, Ssm Health Good Samaritan Hospital, Ssm Health St Anthony Hospital - Mid, Ssm Health St Anthony Hospital - Okc, Ssm Health St Clare Hospital, Ssm Health St. Agnes Hospital, Ssm Health St. Joseph Hospital - Lsl, Ssm Health St. Joseph Hospital - Sc, Ssm Health St. Marys Hospital, Ssm Health St. Marys Hospital - Stl, Ssm Health-St. Marys-Jefferson City, Ssm Saint Louis University Hospital, St Anthony Shawnee Hospital, St. Clare Hospital, St. Marys Hospital, St. Marys Janesville Hospital, Stoughton Hospital Association, Upland Hills Health, Washington County Hospital, Waupun Memorial Hospital, Weatherford Regional Hospital"
HSI00000903,SUNY Downstate Medical Center,268.0,74.23191789759815,78.27409305791069,74.85,66.53333333333333,False,NY,University Hospital At Downstate
HSI00000904,SUNY Upstate Medical University,645.0,61.81544399703663,124.14577381982532,675.0447115384616,600.0397435897437,True,NY,University Hospital At Syracuse
HSI00000911,Saint Bernards Healthcare,404.0,43.646569412124755,97.74974894065203,39.25673076923077,34.8948717948718,True,AR,"Crossridge Community Hospital, St Bernards Medical Center"
HSI00000912,Saint Charles Health System,321.0,78.10430874937896,93.63853616041106,65.12115384615385,57.88547008547009,True,OR,"St Charles Madras, St Charles Medical Center, St. Charles Med Ctr - Prineville"
HSI00000913,Saint Clair Hospital,294.0,43.88019742072269,68.95144864920317,121.84759615384615,108.30897435897437,True,PA,St. Clair Memorial Hospital
HSI00000914,Saint Claire Regional Medical Center,100.0,44.15074735209285,114.97777292735276,26.431730769230768,23.494871794871795,True,KY,St. Claire Medical Center
HSI00000917,Saint Elizabeth Healthcare,809.0,51.90486621985009,90.17906198491583,105.88028846153846,94.11581196581197,True,"IN, KY","St Elizabeth - Grant County, St Elizabeth Dearborn, St Elizabeth Ft Thomas, St Elizabeth Healthcare, St. Elizabeth Florence"
HSI00000919,Saint Francis Health System,1421.0,47.46629349429122,58.29241824542823,246.94278846153847,219.50470085470087,True,OK,"Osu Medical Center, Saint Francis Hospital, Saint Francis Hospital Muskogee, Saint Francis Hospital South, Saint Francis Hospital Vinita"
HSI00001588,Saint Johns Health,48.0,61.37328659454069,84.99879592405365,48.31346153846154,42.945299145299145,True,WY,St. Johns Hospital
HSI00000927,Saint Josephs Candler Health System,494.0,45.86165812393012,61.6774389328937,109.03102403846154,96.91646581196582,True,GA,"Candler Hospital  Inc, St. Josephs Hospital  Inc."
HSI00000929,Saint Josephs Health,643.0,57.798910814928966,108.31600278482271,58.00673076923077,51.56153846153847,True,NJ,St. Josephs University Medical Cent
HSI00000930,Saint Lawrence Health System,119.0,53.702229442691824,119.92637125368937,48.541346153846156,43.14786324786325,True,NY,"Canton-Potsdam Hospital, Gouverneur Hospital"
HSI00000934,Saint Lukes,922.0,51.38109203259828,130.86340653128116,302.7442307692308,269.1059829059829,True,ID,"St Lukes Magic Valley Reg Med Ctr, St. Lukes Elmore Medical Center, St. Lukes Jerome Ltd, St. Lukes Mccall, St. Lukes Nampa Medical Center, St. Lukes Regional Medical Center, St. Lukes Wood River Medical Center, Weiser Memorial Hospital"
HSI00000933,Saint Lukes Episcopal Presbyterian Hospital,445.0,53.20778948823458,95.88018877283486,16.961778846153845,15.077136752136752,True,MO,"St. Lukes Des Peres Hospital, St. Lukes Hospital"
HSI00000935,Saint Lukes Health System MO,1018.0,53.00324451447349,69.54689914927359,286.1807692307692,254.382905982906,True,"KS, MO","Allen County Regional Hospital, Anderson County Hospital, Hedrick Medical Center, Saint Lukes Hospital Of Kansas City, Saint Lukes North Hospital, St. Lukes East - Lees Summit, St. Lukes South, Wright Memorial Hospital"
HSI00000937,Saint Lukes Hospital of Duluth,254.0,54.53286096379808,73.72854053715253,15.340865384615384,13.636324786324787,True,MN,"Aspirus Lake View Hospital, St. Lukes Hospital Of Duluth"
HSI00000936,Saint Lukes University Health Network,1376.0,62.28679368709911,80.00660632542655,18.484615384615385,16.430769230769233,True,"NJ, PA","Geisinger Stlukes, Miners Memorial Medical Center, Quakertown Community Hospital, St Luke Hospital Anderson Campus, St Lukes Hospital - Easton Campus, St Lukes Hospital-Carbon Campus, St Lukes Warren Hospital, St. Lukes Hospital, St. Lukes Hospital - Monroe Campus"
HSI00001381,Saint Marys Healthcare,100.0,39.2448322939231,108.17183853761529,34.61153846153846,30.76581196581197,True,NY,St. Marys Healthcare
HSI00000943,Saint Peters Health,125.0,43.75191183644578,106.0577179745525,37.858490384615386,33.65199145299145,True,MT,St. Peters Hospital
HSI00000942,Saint Peters Healthcare System,337.0,51.38172731690263,97.7130194136374,23.10528846153846,20.53803418803419,True,NJ,St. Peters University Hospital
HSI00001571,Saint Tammany Health System,262.0,46.02621913445944,52.536741365423794,10.147596153846154,9.020085470085471,False,LA,St. Tammany Parish Hospital
HSI00000947,Salem Health Hospitals and Clinics,562.0,68.05488142810002,82.7739947764743,189.0485576923077,168.04316239316242,True,OR,"Salem Health West Valley, Salem Hospital"
HSI00001350,Salem Regional Medical Center,87.0,41.98242699176118,91.83650180086408,19.505860576923077,17.338542735042736,True,OH,Salem Community Hospital
HSI00000948,Salina Regional Health Center,222.0,41.55964024251232,129.35612321562735,6.399038461538462,5.688034188034188,True,KS,"Cloud County Health Center, Lindsborg Community Hospital, Salina Regional Health Center, Salina Surgical Hospital"
HSI00000949,Salinas Valley Memorial Healthcare System,240.0,106.26059023657243,117.15757740550052,62.16761538461538,55.26010256410257,True,CA,Salinas Valley Memorial Hospital
HSI00000952,Samaritan Health,185.0,47.74701247375599,96.15927098663575,64.68173076923077,57.4948717948718,True,NY,"Clifton-Fine Hospital, Samaritan Medical Center"
HSI00000951,Samaritan Health Services,298.0,71.04934318177098,93.21234541171968,109.16325961538462,97.03400854700855,True,OR,"Good Samaritan Hospital Corvallis, North Lincoln Hospital, Samaritan Albany General Hospital, Samaritan Lebanon Comm Hospital, Samaritan Pacific Comm Hospital"
HSI00000953,Samaritan Healthcare,47.0,36.79293091953246,109.64882243510077,62.28221153846154,55.36196581196582,True,WA,Samaritan Hospital
HSI00000954,San Antonio Regional Hospital,363.0,66.07445563244316,95.58369219408516,62.82680288461538,55.84604700854701,True,CA,San Antonio Regional Hospital
HSI00001351,San Francisco Health Network,290.0,142.18776180524523,73.0783854069443,471.8345384615385,419.4084786324787,False,CA,"Laguna Honda Hospital, Zuckerberg San Francisco General"
HSI00001457,San Joaquin County Clinics,152.0,88.66467883418123,108.79771724823436,119.82670192307693,106.51262393162393,True,CA,San Joaquin General Hospital
HSI00000956,San Juan Regional Medical Center,182.0,43.519310455459085,85.2133762899579,97.4581778846154,86.62949145299146,True,NM,San Juan Regional Medical Center
HSI00001403,San Mateo County Health,69.0,103.1003795367043,112.10522574389334,60.192019230769226,53.504017094017094,True,CA,San Mateo Medical Center
HSI00000958,Sanford Health,1983.0,49.035678867966745,94.06610504552756,483.65082211538464,429.91184188034197,True,"IA, MN, MT, ND, SD","Community Memorial Hospital, Coteau Des Prairies, Logan Health Chester, Murray County Memorial Hospital, Northwood Deaconess Health Center, Orange City Municipal Hospital, Ortonville Area Health Services, Perham Health, Pioneer Memorial Hospital And Health, Sanford Aberdeen Medical Center, Sanford Bagley Medical Center, Sanford Bemidji, Sanford Bismarck, Sanford Chamberlain Medical Center, Sanford Hillsboro, Sanford Hospital Canby, Sanford Hospital Luverne, Sanford Hospital Tracy, Sanford Hospital Webster, Sanford Mayville, Sanford Medical Center - Fargo, Sanford Medical Center Canton, Sanford Medical Center Clear Lake, Sanford Medical Center Jackson, Sanford Medical Center Sheldon, Sanford Medical Center Vermillion, Sanford Medical Center Westbrook, Sanford Medical Center Wheaton, Sanford Regional Hospital Worthingto, Sanford Thief River Falls, Sanford Usd Medical Center, West River Regional Medical Center, Windom Area Hospital, Winner Regional Healthcare Center"
HSI00000959,Santa Clara Valley Health and Hospital System,863.0,116.56710157708635,145.76994338118848,92.89519230769231,82.57350427350427,True,CA,Santa Clara Valley Medical Center
HSI00000961,Sarah Bush Lincoln Health System,100.0,52.23720815631611,129.0893950599024,32.50480769230769,28.89316239316239,True,IL,Sarah Bush Lincoln Health Center
HSI00000962,Sarasota Memorial Health Care System,969.0,52.73105318645692,83.88650657871885,73.91329807692308,65.7007094017094,True,FL,"Sarasota Memorial Hospital, Sarasota Memorial Hospital Venice"
HSI00001352,Schneck Medical Center,58.0,50.02654794094403,53.64415673216993,32.34326923076923,28.749572649572652,False,IN,Schneck Medical Center
HSI00001475,ScionHealth,1772.0,44.876437276594835,87.04675291086608,96.66201923076923,85.92179487179487,True,"AL, GA, ID, KY, MS, OH, OK, SC, TN, TX, WI, WV, WY","Andalusia Regional Hospital, Bolivar Medical Center, Carolina Pines Regional Medical Cent, Clinton Memorial Hospital, Ennis Regional Medical Center, Livingston Regional Hospital, Logan Memorial Hospital, Logan Regional Medical Center, Palestine Regional Medical Center, Parkview Regional Hospital, Sage West Health Care, Southwestern Medical Center, St Joseph Regional Medical Center, St. Francis Hospital  Inc., Vaughan Regional Medical Center, Watertown Regional Medical Center"
HSI00000968,Scripps Health,1246.0,71.78592607459925,96.61131375705581,23.59278846153846,20.971367521367522,True,CA,"Scripps Green Hospital, Scripps Memorial Hospital - La Jolla, Scripps Memorial Hospital-Encinitas, Scripps Mercy Hospital"
HSI00001354,Self Regional Healthcare,315.0,43.14859315726973,86.39907215303269,59.189966346153845,52.613303418803426,True,SC,"Edgefield County Healthcare, Self Regional Healthcare"
HSI00000972,Sentara Healthcare,2348.0,59.51281768274552,68.78530831096282,460.0801057692308,408.9600940170941,True,"NC, VA","Halifax Regional Hospital, Sentara Albemarle Regl Med Ctr Llc, Sentara Careplex Hospital, Sentara Leigh Hospital, Sentara Martha Jefferson Hospital, Sentara Norfolk General Hospital, Sentara Northern Virginia Med Ctr, Sentara Obici Hospital, Sentara Princess Anne Hospital, Sentara Rmh Medical Center, Sentara Va. Beach General Hospital, Sentara Williamsburg Regional Medica"
HSI00000975,Shannon Health System,376.0,47.61841934441793,79.55548321079497,226.39103365384614,201.23647435897436,True,TX,Shannon Medical Center
HSI00000977,Sharp Healthcare,1601.0,74.94936635848698,132.8292372919204,108.1874375,96.16661111111111,True,CA,"Grossmont Hospital, Sharp Chula Vista Medical Center, Sharp Coronado Hospital, Sharp Memorial Hospital"
HSI00001532,Shore Physicians Group,199.0,63.86228119429661,87.64053620233396,33.246634615384615,29.552564102564105,True,NJ,Shore Memorial Hospital
HSI00000984,Signature Healthcare,139.0,54.31457951544293,93.42472666105971,7.43125,6.605555555555556,True,MA,Brockton Hospital  Inc.
HSI00000985,Silver Cross Hospital,320.0,53.342592344195886,99.27235773616496,26.39386057692308,23.461209401709404,True,IL,Silver Cross Hospital
HSI00000987,Sinai Health System,389.0,50.05725148669472,106.00297536945813,73.19711538461539,65.06410256410257,True,IL,"Holy Cross Hospital, Mount Sinai Hospital Medical Center"
HSI00000988,Singing River Health System,433.0,41.357354319552016,51.56310372172708,177.63413461538462,157.89700854700854,True,MS,"Singing River Gulfport, Singing River Health System"
HSI00000180,Skagit Regional Health,185.0,57.20888453821788,125.06042225995364,56.998701923076915,50.66551282051282,True,WA,"Cascade Valley Hospital, Phd#1  Dba Skagit Valley Hospital"
HSI00000994,Sky Lakes Medical Center,90.0,56.49486071783273,104.52790460107992,66.8770673076923,59.446282051282054,True,OR,Sky Lakes Medical Center
HSI00000944,Slidell Memorial Hospital,339.0,52.63947197541764,73.2026611608167,10.478365384615385,9.314102564102564,True,LA,Slidell Memorial Hospital
HSI00000338,Solutionhealth,354.0,57.817950769085414,61.4827982190837,173.74375,154.4388888888889,False,NH,"Elliot Hospital, Southern Nh Medical Center"
HSI00001441,South Central Regional Medical Center Health System,268.0,38.44012792286093,59.532672848140926,3.997158653846154,3.553029914529915,True,MS,South Central Regional Medical Centr
