Health_System_ID,Health_System_Name,Bed_Size,Staff_Labor_Rate,Agency_Labor_Rate,Agency_Labor_FTE,Estimated_RN_Need,Agency>Staff,State(s),Affiliated_Hospitals
HSI00000584,Lifepoint Health,5825.0,46.86049319878388,75.3688885374187,1069.9865384615384,951.0991452991453,True,"AL, AR, AZ, IA, IN, KY, MI, MT, NC, NM, NV, OR, PA, TN, TX, UT, VA, WA, WV","Ashley Regional Medical Center, Athens Regional Medical Center, Bell Memorial Hospital, Bluegrass Community Hospital, Bourbon Community Hospital, Canyon Vista Medical Center, Castleview Hospital, Central Carolina Hospital, Clark Memorial Hospital, Clark Regional Medical Center, Clinch Valley Medical Center, Community Medical Center, Danville Regional Medical Center, Fauquier Hospital, Fleming County Hospital, Frye Regional Medical Center, Georgetown Community Hospital, Harris Regional Hospital, Havasu Regional Medical Center, Haywood Regional Medical Center, Jackson Purchase Medical Center, Lake Cumberland Regional Hosp, Los Alamos Medical Center, Lourdes Medical Center, Maria Parham Medical Center, Marquette General Hospital, Meadowview Regional Medical Center, Memorial Medical Center, Meyersdale Community Hospital, Miners Hospital, Nason Hospital, National Park Medical Center, North Alabama Medical Center, Northeastern Nevada Regional Hospita, Ottumwa Regional Health Center, Paris Regional Medical Center, Person Memorial Hospital Inc, Portage Health System, Raleigh General Hospital, Riverview Regional Medical Center, Rutherford Hospital  Inc., Saline Memorial Hospital, Shoals Hospital, So Tenn Reg Med Ctr Of Pulaski, Southern Tennessee Medical Center, Southern Tn Lawrenceburg Hospital, Spring View Hospital, St. Marys Regional Medical Center, Sumner Regional Medical Center, Swain County Hospital, Trios Health, Trousdale Medical Center, Twin County Regional Hospital, Valley View Medical Center, Willamette Valley Medical Center, Wilson Medical Center, Wythe County Community Hospital"
HSI00000585,Lifespan,963.0,32.80103040232383,109.5062062586321,183.53758653846154,163.14452136752138,True,RI,"Newport Hospital, Rhode Island Hospital, The Miriam Hospital"
HSI00001560,Little Company of Mary Hospital of Indiana,96.0,53.64485121457599,56.70379150871274,54.77447115384615,48.688418803418806,False,IN,Memorial Hosp & Health Care Ctr
HSI00000538,Logan Health,288.0,53.3903159447841,104.60733635229028,46.24835576923077,41.10964957264958,True,MT,"Logan Health  Cutbank, Logan Health Conrad, Logan Health Medical Center, Logan Health Shelby, Logan Health Whitefish"
HSI00000591,Loma Linda University Health,912.0,65.0143440919021,92.91509958937327,160.6268846153846,142.77945299145298,True,CA,"Llumc Murrieta, Loma Linda University Childrens Hosp, Loma Linda University Medical Center"
HSI00000593,Los Angeles County Department of Health Services,1179.0,77.89169719769058,86.06397375253405,1676.2057692307692,1489.9606837606839,False,CA,"Harbor-Ucla Medical Center, Lac Olive View/Ucla Medical Center, Los Angeles General Medical Center"
HSI00000038,Luminis Health,618.0,54.187452867062966,92.287414452637,156.96503365384615,139.52447435897437,True,MD,"Anne Arundel Medical Center Inc., Doctors Community Hospital"
HSI00001464,MLK Community Healthcare,152.0,65.82360329200034,120.20753881668406,136.83028846153846,121.62692307692308,True,CA,Martin Luther King Community Hosp
HSI00000608,Main Line Health,1105.0,40.7517196315544,94.72618052653573,36.815384615384616,32.72478632478633,True,PA,"Bryn Mawr Hospital, Lankenau Medical Center, Paoli Hospital, Riddle Hospital"
HSI00000610,MaineGeneral Health,186.0,46.66437136773881,56.02205219502693,53.06466346153846,47.16858974358975,True,ME,Mainegeneral Medical Center
HSI00000611,MaineHealth,1285.0,44.04718074178995,113.25159983362153,562.1220048076923,499.6640042735043,True,"ME, NH","Franklin Memorial Hospital, Lincoln Hospital, Mainehealth Maine Medical Center, Mainehealth Memorial Hospital, Mainehealth Stephens Hospital, Mainehealth Waldo Hospital, Mid Coast Hospital, Penobscot Bay Medical Center, Southern Maine Health Care"
HSI00000612,Major Health Partners,46.0,52.50600008037636,85.76340894636421,4.535576923076923,4.031623931623932,True,IN,Major Hospital
HSI00000616,MarinHealth,310.0,110.5181087774113,76.97374317081157,55.791346153846156,49.59230769230769,False,CA,Marinhealth Medical Center
HSI00000619,Marshall Medical Center,111.0,74.02077664030699,103.09228821937045,1.561110576923077,1.3876538461538461,True,CA,Marshall Hospital
HSI00000621,Marshfield Clinic Health System,602.0,48.245292132240216,88.55692418262363,318.4144230769231,283.03504273504274,True,"MI, WI","Beaver Dam Community Hospitals, Dickinson County Healthcare System, Lakeview Medical Center Of Rice Lake, Marshfield Medical Center, Marshfield Medical Center - River Re, Marshfield Medical Center Neillsvill, Marshfield Medical Center Weston, Marshfield Medical Center- Park Fall, Marshfield Medical Center-Eau Claire, Marshfield Medical Center-Ladysmith, Marshfield Medical Center-Minocqua"
HSI00000624,Mary Washington Healthcare,516.0,51.48784170487157,100.13677939672692,155.51431250000002,138.23494444444447,True,VA,"Mary Washington Hospital, Stafford Hospital"
HSI00000813,Mass General Brigham,2829.0,70.10228200164757,99.68327599332846,1019.4601394230768,906.1867905982906,True,"MA, NH","Brigham And Womens Hospital, Cooley Dickinson Hospital, Dana-Farber Cancer Institute, Faulkner Hospital, Marthas Vineyard Hospital, Massachusetts Eye And Ear Infirmary, Massachusetts General Hospital, Nantucket Cottage Hospital, Newton Wellesley Hospital, North Shore Medical Center, Wentworth Douglass Hospital"
HSI00000630,Maury Regional Medical Center,294.0,45.17153381381184,79.81672968437228,23.777403846153845,21.13547008547009,True,TN,"Marshall Medical Center, Maury Regional Hospital, Wayne Medical Center"
HSI00000631,Mayo Clinic Health System,2838.0,63.026747389668955,98.34130622603246,194.95646634615386,173.2946367521368,True,"AZ, FL, IA, MN, WI","Cannon Falls Medical Center - Mayo, Kingman Regional Medical Center, Mayo Clinic Florida, Mayo Clinic Health Sys - New Prague, Mayo Clinic Health Sys - St. James, Mayo Clinic Health System - Red Wing, Mayo Clinic Health System - Waseca, Mayo Clinic Health System-Fairmont, Mayo Clinic Hospital, Mayo Clinic Hospital Rochester, Mayo Clnic Health System - Lake City, Mayo Clnic Hlth Sys-Albrt Lea Austin, Mchs - Southwest Minnesota Region, Mchs Eau Claire Hospital, Mchs Northland, Mchs Oakridge, Mchs Southwest Wi La Crosse, Mchs-Chippewa Valley, Mchs-Red Cedar, Mchs-Swwi Region  Inc - Sparta, Winneshiek Medical Center"
HSI00000636,McLaren Health Care Corporation,1688.0,51.9377394080432,95.82901716235327,205.18579807692308,182.3873760683761,True,MI,"Barbara Ann Karmanos Cancer Hospital, Bay Regional Medical Center, Caro Community Hospital, Mclaren Central Michigan, Mclaren Flint, Mclaren Greater Lansing, Mclaren Lapeer Region, Mclaren Macomb, Mclaren Northern Michigan, Mclaren Oakland, Mclaren Port Huron, Mclaren Thumb Region"
HSI00000637,McLeod Health,845.0,46.99445852784166,79.75090705465371,21.781721153846156,19.361529914529918,True,SC,"Mcleod Health Cheraw, Mcleod Health Clarendon, Mcleod Loris Seacoast Hospital, Mcleod Medical Center - Dillon, Mcleod Regional Medical Center"
HSI00000640,MedStar Health,2454.0,56.84380591799201,113.64448989837294,836.1288701923077,743.2256623931625,True,"DC, MD","Georgetown University Hospital, Good Samaritan Hospital, Medstar Franklin Square Medical Ctr, Medstar Harbor Hospital, Medstar Montgomery Medical Center, Medstar Southern Maryland Hospital C, Medstar Union Memorial Hospital, St. Marys Hospital, Washington Hospital Center"
HSI00000644,Medical University of South Carolina Medical Center,1680.0,53.91346606077586,52.683527445427046,399.25384615384615,354.8923076923077,False,SC,"Medical University Of South Carolina, Musc Health Chester Medical Center, Musc Health Columbia Medical Center, Musc Health Florence Medical Center, Musc Health Kershaw Medical Center, Musc Health Lancaster Medical Center, Musc Health Marion  Medical Center"
HSI00000642,Medisys Health Network,522.0,69.45400309815973,130.93044716245927,129.67451923076922,115.26623931623934,True,NY,"Flushing Hospital Medical Center, Jamaica Hospital Medical Center"
HSI00000648,Memorial Health System IL,714.0,47.82993428336252,92.67910402751811,234.75459134615383,208.67074786324787,True,"IL, OH","Decatur Memorial Hospital, Jacksonville Memorial Hospital, Lincoln Memorial Hospital, Memorial Hospital Of Union County, Springfield Memorial Hospital, Taylorville Memorial Hospital"
HSI00000649,Memorial Health System OH,219.0,43.29196688431685,129.31436103110943,80.79423076923077,71.81709401709402,True,"OH, WV","Marietta Memorial Hospital, Selby General Hospital, Sistersville General Hospital"
HSI00000652,Memorial Healthcare,113.0,44.969072757320575,79.61828206616367,8.283653846153847,7.363247863247863,True,MI,Memorial Healthcare
HSI00000653,Memorial Healthcare System,1697.0,49.549559719694244,66.7998408195346,290.6715384615385,258.3747008547009,True,FL,"Memorial Hospital Miramar, Memorial Hospital Pembroke, Memorial Hospital West, Memorial Regional Hospital"
HSI00000654,Memorial Hermann Healthcare System,3690.0,57.513881644864256,44.12272581953245,742.7570000000001,660.2284444444444,False,TX,"Memorial Hermann  Hospital Sys, Memorial Hermann First Colony, Memorial Hermann Katy, Memorial Hermann Memorial City Medic, Memorial Hermann Northeast, Memorial Hermann Sugarland, Memorial Hermann Texas Medical Cntr"
HSI00000655,Memorial Hospital at Gulfport,295.0,45.03511266174545,116.27295688021292,19.631024038461536,17.449799145299146,True,MS,Memorial Hospital At Gulfport
HSI00001424,Memorial Hospital of Sweetwater County,58.0,56.52647551569297,90.45747597077165,23.05585576923077,20.494094017094017,True,WY,Mem. Hospt. Of Sweetwater County
HSI00000658,MemorialCare Health System,838.0,68.79728800617002,97.4826891681165,148.4348798076923,131.9421153846154,True,CA,"Memorialcare Long Beach Med Ctr, Memorialcare Orange Coast Med Ctr, Memorialcare Saddleback Med Ctr"
HSI00000660,Mercy,4326.0,49.205318915145334,78.95862400488869,1000.425625,889.2672222222224,True,"AR, IN, KS, MO, OK","Arbuckle Memorial Hospital, Hermann Area District Hospital, Mercy Health/Love County, Mercy Hospital - St. Louis, Mercy Hospital - Washington, Mercy Hospital Ada, Mercy Hospital Ardmore, Mercy Hospital Aurora, Mercy Hospital Berryville, Mercy Hospital Booneville, Mercy Hospital Carthage, Mercy Hospital Cassville, Mercy Hospital Columbus, Mercy Hospital Fort Smith, Mercy Hospital Healdton  Inc., Mercy Hospital Jefferson, Mercy Hospital Joplin, Mercy Hospital Kingfisher, Mercy Hospital Lebanon, Mercy Hospital Lincoln, Mercy Hospital Logan County, Mercy Hospital Okc, Mercy Hospital Ozark, Mercy Hospital Paris, Mercy Hospital Perry County, Mercy Hospital South, Mercy Hospital Springfield, Mercy Hospital Tishomingo, Mercy Hospital Waldron, Mercy Hospital Watonga, Mercy Medical Center, Mercy Specialty Hospital - Southeast, Mercy St Francis Hospital, Oklahoma Heart Hospital South, Perry County Hospital, Washington County Memorial Hospital"
HSI00000666,Mercy Medical Center IA,216.0,47.06349451275817,103.47856742185796,61.70961538461538,54.85299145299145,True,IA,Mercy Medical Center
HSI00000663,Mercy Medical Center MD,151.0,46.38343975216052,48.17748736810819,51.761538461538464,46.01025641025642,False,MD,Mercy Medical Center
HSI00000667,Mercyhealth,363.0,48.03091067332996,114.08883534229018,73.49617307692309,65.32993162393163,True,"IL, WI","Harvard Memorial Hospital, Javon Bea Hospital, Mercy Health System Corporation, Mercy Walworth Hospital"
HSI00000671,Meritus Health,242.0,47.72941118942119,100.16011080601186,99.09903846153846,88.0880341880342,True,MD,Meritus Medical Center
HSI00000672,Methodist Health System NE,546.0,57.20868372504832,103.07871116744613,107.8635673076923,95.87872649572651,True,"IA, NE","Jennie Edmundson Memorial, Methodist Fremont Health, Nebraska Methodist Hospital"
HSI00000673,Methodist Health System TX,1376.0,55.32570483072434,80.01394083834651,258.61346153846154,229.8786324786325,True,TX,"Methodist Charlton Medical Center, Methodist Dallas Medical Center, Methodist Hospital For Surgery, Methodist Mansfield Medical Center, Methodist Mckinney Hospital, Methodist Midlothian Medical Center, Methodist Richardson Medical Center, Methodist Southlake Medical Center"
HSI00000675,Methodist Le Bonheur Healthcare,1441.0,48.1447675821956,86.49073469885707,204.3693173076923,181.66161538461537,True,"MS, TN","Methodist H/C Memphis Hospt., Methodist H/C Olive Branch Hospital"
HSI00000683,Middlesex Health System,187.0,56.760621489187315,74.58855490316361,5.486057692307693,4.876495726495727,True,CT,Middlesex Hospital
HSI00000684,Midland County Hospital District,261.0,42.381842915803034,102.62156824782188,124.15865384615384,110.36324786324786,True,TX,Midland Memorial Hospital
HSI00000694,Missouri Delta Medical Center,98.0,33.4390595569407,112.10028296547821,8.495192307692308,7.551282051282051,True,MO,Missouri Delta Medical Center
HSI00000697,Mohawk Valley Health System,354.0,50.50028046133668,101.11935835573259,178.14807692307693,158.35384615384618,True,NY,Wynn Hospital
HSI00001443,Montage Health,227.0,102.00728794953439,109.7999275616956,51.675274038461545,45.933576923076934,False,CA,Community Hosp. Monterey Peninsula
HSI00000700,Montefiore Medical Center,2374.0,79.28260383853925,99.71057273293215,324.3557692307692,288.3162393162393,True,NY,"Montefiore Medical Center, Montefiore New Rochelle Hospital, Montefiore Nyack Hospital, St. Lukes Cornwall Hospital, The Mount Vernon Hospital, White Plains Hospital"
HSI00000868,Monument Health,525.0,47.73313215785658,77.60903275996615,338.439875,300.8354444444444,True,"SD, WY","Fall River Hospital, Monument Health Custer Hospital, Monument Health Lead-Deadwood Hospit, Monument Health Rapid City Hospital, Monument Health Spearfish Hospital, Monument Health Sturgis Regional, Philip Health Services Inc, Same Day Surgery Center, Weston County Health Services"
HSI00000705,Mosaic Life Care,391.0,45.4284201609392,101.78947702645753,83.27932692307692,74.02606837606838,True,MO,"Harrison County Community Hospital, Heartland Regional Medical Center, Mosaic Medical Center - Maryville, Northwest Medical Center"
HSI00000710,Mount Nittany Health System,248.0,64.36452997465693,102.5327054953164,73.94627403846154,65.73002136752137,True,PA,Mount Nittany Medical Center
HSI00000711,Mount Sinai Health System,2391.0,88.60453484817323,90.93956861880581,339.9050673076923,302.1378376068376,False,NY,"Mount Sinai Health System-Beth Israe, Mount Sinai Hospital, Mount Sinai St. Lukes Roosevelt Hosp, New York Eye And Ear Infirmary, South Nassau Communities Hospital"
HSI00000712,Mount Sinai Medical Center of Florida,481.0,46.88530942577785,86.30114112753198,36.451379807692305,32.4012264957265,True,FL,Mount Sinai Medical Center Of Florid
HSI00001334,Mountain View Hospital,40.0,41.72873633890679,83.19309986632268,112.92980769230769,100.3820512820513,True,ID,Mountain View Hospital
HSI00000714,Multicare Health System,1554.0,74.26537618905405,87.80326069732587,530.3139471153846,471.39017521367526,True,WA,"Capital Medical Center, Deaconess Medical Center, Good Samaritan Hospital, Multicare Auburn Medical Center, Multicare Covington Medical Center, Tacoma General Allenmore Hospital, Valley Hospital & Medical Center, Yakima Valley Memorial Hospital"
HSI00000715,Munson Healthcare,624.0,48.89894359843997,46.53511294670619,58.501254807692305,52.00111538461539,False,MI,"Kalkaska Memorial Health Center, Munson Healthcare Cadillac Hospital, Munson Healthcare Charlevoix Hospita, Munson Healthcare Grayling Hospital, Munson Healthcare Manistee Hospital, Munson Medical Center, Otsego Memorial Hospital, Paul Oliver Memorial Hospital"
HSI00000716,NCH Healthcare System,500.0,54.207636609227634,97.41388497236326,55.58028846153846,49.404700854700856,True,FL,Naples Community Hospital
HSI00000717,NYU Langone Health,1766.0,78.35012440112455,107.72308655106607,186.67836538461538,165.93632478632478,True,NY,"Long Island Community Hospital, Nyu Langone Hospitals"
HSI00000723,Natividad Medical Center,144.0,97.1368026763761,114.48124168942513,37.450836538461544,33.289632478632484,True,CA,Natividad Medical Center
HSI00000729,New Liberty Hospital District of Clay County,199.0,53.96288935505354,104.49930171964564,23.064903846153847,20.502136752136753,True,MO,Liberty Hospital
HSI00000730,New York City Health and Hospitals Corporation,3096.0,70.907315808985,88.95325621507753,2760.5788461538464,2453.847863247863,True,NY,"Bellevue Hospital Center, Elmhurst Hospital Center, Harlem Hospital Center, Jacobi Medical Center, Lincoln Medical&Mental Health Center, Metropolitan Hospital Center, Nyc Health + Hospital / South Brookl, Nyc Health+Hospital/Kings County, Queens Hospital Center, Woodhull Hospital Center"
HSI00000731,New York Presbyterian Healthcare System,3458.0,84.43284952939891,117.77359997670268,462.25192307692305,410.89059829059835,True,NY,"New York Presbyterian Hospital, New York Presbyterian Hudson Valley, Newyork-Presbyterian/Queens"
HSI00000743,Norman Regional Health System,322.0,51.30422819929874,77.33697258363851,29.086365384615384,25.85454700854701,True,OK,Norman Regional Hospital Authority
HSI00000748,North Kansas City Hospital,385.0,53.13722605737723,85.39249281633255,71.77740384615385,63.802136752136754,True,MO,North Kansas City Hospital
HSI00000749,North Memorial Health,467.0,66.57282726439459,96.36695880873965,84.7015,75.29022222222223,True,MN,"Maple Grove Hospital, North Memorial Health Hospital"
HSI00000750,North Mississippi Health Services,760.0,41.317870154451796,81.9860029381128,145.1939326923077,129.06127350427352,True,"AL, MS","Clay County Medical Corporation, Marion Regional Medical Center, Monroe Health Services  Inc., North Mississippi Medical Center, Pontotoc Health Services, Tishomingo Health Services, Webster Health Services"
HSI00000751,North Oaks Health System,247.0,42.226811222792904,90.50719411451534,64.87407692307691,57.66584615384615,True,LA,North Oaks Medical Center
HSI00000756,NorthShore  Edward-Elmhurst Health,1839.0,57.372263264415125,41.75147536590086,367.81781730769234,326.94917094017103,False,IL,"Edward Hospital, Elmhurst Memorial Hospital, Endeavor Health Clinical Operations, Northwest Community Hospital, Swedish Covenant Health"
HSI00000755,Northbay Healthcare,178.0,91.51654041003422,72.14864248844631,12.52928846153846,11.137145299145299,False,CA,Northbay Hospital Group
HSI00000759,Northeast Georgia Health System,816.0,54.837402811538475,88.69547450896707,166.7158653846154,148.19188034188033,True,GA,"Ngmc Barrow, Ngmc Habersham, Ngmc Lumpkin  Llc, Northeast Georgia Medical Center"
HSI00001338,Northeastern Health System,121.0,32.39710314150427,91.82251576921487,17.21648076923077,15.303538461538462,True,OK,"Northeastern Health System, Sequoyah County City Of Sallisaw Hos"
HSI00000761,Northern Arizona Healthcare,329.0,53.777631337543525,80.2516785933973,247.42485096153845,219.93320085470089,True,AZ,"Flagstaff Medical Center, Verde Valley Medical Center"
HSI00000330,Northern Light Health,673.0,47.431494598175775,93.45626001853904,248.20271634615386,220.62463675213678,True,ME,"Blue Hill Memorial Hospital, Charles A Dean Memorial Hospital, Eastern Maine Medical Center, Houlton Regional Hospital, Inland Hospital, Maine Coast Memorial Hospital, Mayo Regional Hospital, Mercy Hospital, Sebasticook Valley Hospital, The Aroostook Medical Center"
HSI00000765,Northfield Hospital and Clinics,37.0,61.91370514283173,221.12531017369727,1.55,1.377777777777778,True,MN,Northfield City Hospital
HSI00000766,Northside Hospital,1933.0,59.35494426402916,78.63645369548975,343.5971153846154,305.4196581196581,True,GA,"Northside Hospital, Northside Hospital - Duluth, Northside Hospital - Gwinnett, Northside Hospital Forsyth, Northside Hospital-Cherokee  Inc."
HSI00000767,Northwell Health,5541.0,73.41664169383145,106.40181725526672,194.34423076923076,172.75042735042737,True,NY,"Community Memorial Hospital, Glen Cove Hospital, Huntington Hospital, Lenox Hill Hospital, Long Island Jewish Medical Center, Maimonides Medical Center, Mather Hospital, Nassau University Medical Center, North Shore University Hospital, Northern Westchester Hospital, Ny Community Hospital Of Brooklyn (D, Peconic Bay Medical Center, Phelps Memorial Hospital Center, Plainview Hospital, South Shore University Hospital, Staten Island University Hospital"
HSI00000770,Northwestern Medicine,2293.0,57.93755795830654,60.58163834834025,1306.7158653846154,1161.5252136752138,False,IL,"Central Dupage Hospital, Delnor-Community Hospital, Kishwaukee Community Hospital, Northern Illinois Medical Center, Northwestern Lake Forest Hospital, Northwestern Memorial Hospital, Palos Community Hospital, Valley West Community Hospital"
HSI00000771,Norton Healthcare,1657.0,55.39779466732585,84.32971654175246,339.0936586538462,301.4165854700855,True,"IN, KY","Harrison County Hospital, Kings Daughters Hospital, Norton Hospitals  Inc, Scott Memorial Hospital"
HSI00000773,Novant Health,2889.0,54.31249909012521,55.4555598836551,841.6106778846154,748.0983803418803,False,NC,"Ashe Memorial Hospital, Brunswick Medical Center, Forsyth Memorial Hospital  Inc, Medical Park Hospital, New Hanover Regional Medical Center, Novant Health Mint Hill Medical Ctr, Pender Memorial Hospital, Presbyterian Hospital, Presbyterian Hospital Huntersville, Presbyterian Hospital Matthews, Rowan Regional Hospital, Thomasville Medical Center"
HSI00001253,Nuvance Health,1067.0,68.19967285014808,105.08016963410051,98.66938461538462,87.70611965811968,True,"CT, NY","Danbury Hospital, Northern Dutchess Hospital, Norwalk Hospital, Putnam Hospital Center, Sharon Hospital, Vassar Brothers Medical Center"
HSI00000776,OSF Healthcare System,1808.0,52.80249596667237,99.4696684148574,303.06057692307695,269.38717948717954,True,"IL, MI","Little Company Of Mary, Mendota Community Hospital, Osf Heart Of Mary Medical Center, Osf Holy Family Med Ctr, Osf Sacred Heart Medical Center, Osf Saint Anthonys Health Center, Osf Saint Clare Medical Center, Osf Saint Luke Medical Center, Ottawa Regional Hospital & Healthcar, Rochelle Community Hospital, Saint Anthony Medical Center, Saint Francis Medical Center, Saint James Hospital, St. Francis Hospital, St. Joseph Medical Center, St. Mary Medical Center"
HSI00001383,OU Health,842.0,48.520652647666104,81.92668153578322,535.9154807692307,476.3693162393162,True,OK,Ou Medical Center
HSI00001449,Oaklawn Hospital,78.0,42.714644782073385,91.66897613223875,15.942610576923075,14.171209401709403,True,MI,Oaklawn Hospital
HSI00000780,Ochsner Health System,2993.0,44.22146483122859,56.31622236676634,896.3267836538462,796.7349188034189,True,"AL, LA, MS","Acadia General Hospital, Iberia Medical Center, Lafayette General Medical Center, Ochsner - Abrom Kaplan Mh, Ochsner American Legion Hospital, Ochsner Bayou  Llc, Ochsner Choctaw General, Ochsner Clinic Foundation, Ochsner Laird Hospital, Ochsner Lsu Health - St Mary Med Ctr, Ochsner Lsu Health Monroe, Ochsner Lsu Health Shreveport, Ochsner Med Ctr - Hancock, Ochsner Medical Center - Baton Rouge, Ochsner Medical Center - Kenner  Llc, Ochsner Rush Medical Center, Ochsner Scott Regional, Ochsner St. Mary, Ochsner Stennis Hospital, Ochsner Watkins Hospital, Southern Regional Medical Corp, St Martin Hospital, St. Bernard Parish Hospital, St. Charles Parish Hospital, University Hospital & Clinics"
HSI00000784,Ohiohealth,2555.0,51.660079348824226,97.18486835723292,667.6334182692308,593.4519273504275,True,OH,"Berger Hospital, Doctors Hospital, Dublin Methodist Hospital, Grady Memorial Hospital, Grant Medical Center, Hardin Memorial Hospital, Marion General Hospital, Medcentral Health System, Morrow County Hospital, Obleness Memorial Hospital, Riverside Methodist Hospital, Shelby Memorial Hospital, Southeastern Ohio Reg Med Ctr, Van Wert County Hospital"
HSI00000789,Olmsted Medical Center,61.0,54.57564596097003,69.83932070542129,9.936778846153846,8.832692307692307,True,MN,Olmsted Medical Center
HSI00000229,Olympic Medical Center,78.0,57.23641550861029,83.18463340437056,46.04167788461539,40.9259358974359,True,WA,Olympic Medical Center
HSI00000792,Oneida Health,101.0,45.45042441806081,104.92476735059984,4.287980769230769,3.8115384615384618,True,NY,Oneida Health
HSI00000795,Oregon Health and Science University,675.0,75.73154501131027,89.71519741064193,453.86954326923075,403.43959401709395,True,OR,"Ohsu Hospital And Clinics, Tuality Healthcare"
HSI00000796,Orlando Health,2391.0,47.88466539732077,146.7915346254944,39.14134615384615,34.792307692307695,True,FL,"Orlando Health, Orlando Health Bayfront Hospital, Orlando Health South Lake Hospital, Orlando Health-Health Central Hospit, St. Cloud Regional Medical Center"
HSI00001546,OroHealth Corporation,153.0,64.34535866554756,92.64608724295327,10.216826923076923,9.08162393162393,True,CA,Oroville Hospital
HSI00000798,Oswego Health,132.0,44.87534159058935,69.32685945805301,25.86826923076923,22.994017094017096,True,NY,Oswego Hospital
HSI00001436,Overlake Medical Center and Clinics,303.0,78.48593802979248,104.90786386004476,88.37935576923077,78.55942735042734,True,WA,Overlake Hospital Medical Center
HSI00000802,Owensboro Health,398.0,49.91651339351969,92.8559219143211,36.08610096153846,32.07653418803419,True,KY,"Muhlenberg Community Hospital, Owensboro Health Regional Hospital, Owensboro Health Twin Lakes Medical"
HSI00001529,Ozarks Healthcare,111.0,35.008609575742845,117.77630520387856,11.354326923076924,10.092735042735043,True,MO,Ozarks Medical Center
HSI00000805,PIH Health,854.0,67.2690204583631,94.90419398016267,84.04903846153846,74.71025641025642,True,CA,"Pih Health Good Samaritan Hospital, Pih Health Hospital - Downey, Pih Health Whittier Hospital"
